{
  "schema_version": "0.1.0",
  "observation_id": "fixture-unavailable-observation-001",
  "source_id": "fixture-public-network",
  "subject": {
    "subject_id": "ethereum-mainnet",
    "subject_type": "network"
  },
  "observed_at": null,
  "received_at": "2026-08-27T14:00:05Z",
  "source_status": "unavailable",
  "verification_status": "not_applicable",
  "freshness_input": {
    "source_age_seconds": null,
    "derivation_status": "not_available"
  },
  "integrity": {
    "algorithm": "none",
    "digest": null,
    "scope": "no_content",
    "trust_semantics": "content_identity_only"
  },
  "claims": [],
  "provenance": {
    "provider_observation_reference": null,
    "retrieval_mode": "fixture",
    "verification_basis": "not_applicable",
    "normalization_version": "0.1.0"
  },
  "limitations": [
    {
      "limitation_id": "source-unavailable",
      "description": "No source observation was available for normalization.",
      "impact": "material"
    }
  ],
  "authority_effect": "none"
}
